{
  "version": 4,
  "id": "storage-boundaries",
  "deck": "implementation-review",
  "title": "Merge-friendly Git boundaries",
  "rank": 10,
  "section": "Architecture and storage",
  "intent": "explain",
  "layout": "diagram",
  "media_type": "image/svg+xml",
  "entrypoint": "20-s-02beee84cbce-0010-0b1154bf85fa.svg",
  "takeaway": "Each embedded deck is an independent flat bundle inside v3, while existing report records and standalone v4 behavior remain intact.",
  "reading_order": [
    "v3-root",
    "living-records",
    "deck-bundles",
    "legacy-readers",
    "v4-boundary"
  ]
}
